{"attestation":{"evidence_level":"self_declared","maintainer_operated_execution":false,"participant_controlled_execution":true,"participant_is_not_maintainer":true,"private_record_hashes_nonce_hardened":true,"receipt_generated_by_participant":true},"claims":{"external_adoption_verified":false,"independent_host_verified":false,"independent_participant_verified":false,"production_reliability_verified":false},"consent":{"protocol_version_accepted":true,"public_pseudonym_accepted":true,"public_technical_metadata_accepted":true},"evidence_scope":"external_trial_submission_self_attestation_engineering_only","limitations":["Participant and host independence are self-declared until coordinator review.","Private identity and consent records remain outside the repository.","Trial participation does not establish external adoption or production reliability.","Only bounded synthetic engineering metadata from an R5 receipt is bound."],"participant":{"private_consent_record_sha256":"eeeeeeeeeeeeeeeeeeeeeeeeeeeeeeeeeeeeeeeeeeeeeeeeeeeeeeeeeeeeeeee","private_identity_record_sha256":"dddddddddddddddddddddddddddddddddddddddddddddddddddddddddddddddd","public_participant_id":"participant-fedcba9876543210"},"privacy":{"automatic_upload_performed":false,"credentials_included":false,"local_paths_included":false,"personal_identifiers_included":false,"raw_private_records_included":false},"protocol":{"protocol_id":"dl-external-trial-protocol/v1","protocol_sha256":"aaaaaaaaaaaaaaaaaaaaaaaaaaaaaaaaaaaaaaaaaaaaaaaaaaaaaaaaaaaaaaaa"},"schema":"dl-external-trial-submission/v1","source_receipt":{"environment_sha256":"27d3e55dad626b6cc06f3f87c89d97d97e9148b02f58e9e2ee9c401368c72949","receipt_id":"portability-receipt-minimal","receipt_sha256":"9934b2810cb072c9f658e270164f0a5e1e4609e9ce5910cd313169ec3e271bfd","repository":{"archive_sha256":"cccccccccccccccccccccccccccccccccccccccccccccccccccccccccccccccc","commit_oid":"aaaaaaaaaaaaaaaaaaaaaaaaaaaaaaaaaaaaaaaa","dirty":false,"tree_oid":"bbbbbbbbbbbbbbbbbbbbbbbbbbbbbbbbbbbbbbbb"},"trial_plan_sha256":"0000000000000000000000000000000000000000000000000000000000000000"},"status":"submitted_unreviewed","submission_id":"dl-external-submission-c9ef1be88637a547","submitted_at":"2026-08-24T09:05:00Z"}
